
*** Running vivado
    with args -log design_1_wrapper.vdi -applog -m64 -product Vivado -messageDb vivado.pb -mode batch -source design_1_wrapper.tcl -notrace



****** Vivado v2025.1 (64-bit)
  **** SW Build 6140274 on Thu May 22 00:12:29 MDT 2025
  **** IP Build 6138677 on Thu May 22 03:10:11 MDT 2025
  **** SharedData Build 6139179 on Tue May 20 17:58:58 MDT 2025
  **** Start of session at: Thu Feb 12 23:50:12 2026
    ** Copyright 1986-2022 Xilinx, Inc. All Rights Reserved.
    ** Copyright 2022-2025 Advanced Micro Devices, Inc. All Rights Reserved.

source design_1_wrapper.tcl -notrace
create_project: Time (s): cpu = 00:00:09 ; elapsed = 00:00:06 . Memory (MB): peak = 491.875 ; gain = 210.250
INFO: [IP_Flow 19-234] Refreshing IP repositories
INFO: [IP_Flow 19-1704] No user IP repositories specified
INFO: [IP_Flow 19-2313] Loaded Vivado IP repository 'C:/Xilinx/2025.1/Vivado/data/ip'.
Command: link_design -top design_1_wrapper -part xc7s25csga324-1
Design is defaulting to srcset: sources_1
Design is defaulting to constrset: constrs_1
INFO: [Device 21-403] Loading part xc7s25csga324-1
INFO: [Project 1-5699] Read binary netlist with skipMacroContent - 1
INFO: [Project 1-454] Reading design checkpoint 'c:/Users/dlnmt/man_bram/man_bram.gen/sources_1/bd/design_1/ip/design_1_UART_0_2/design_1_UART_0_2.dcp' for cell 'design_1_i/UART_0'
INFO: [Project 1-454] Reading design checkpoint 'c:/Users/dlnmt/man_bram/man_bram.gen/sources_1/bd/design_1/ip/design_1_proc_sys_reset_0_0/design_1_proc_sys_reset_0_0.dcp' for cell 'design_1_i/proc_sys_reset_0'
INFO: [Project 1-454] Reading design checkpoint 'c:/Users/dlnmt/man_bram/man_bram.gen/sources_1/bd/design_1/ip/design_1_system_ila_0_2/design_1_system_ila_0_2.dcp' for cell 'design_1_i/system_ila_0'
Netlist sorting complete. Time (s): cpu = 00:00:00 ; elapsed = 00:00:00.025 . Memory (MB): peak = 722.383 ; gain = 0.000
INFO: [Netlist 29-17] Analyzing 118 Unisim elements for replacement
INFO: [Netlist 29-28] Unisim Transformation completed in 0 CPU seconds
INFO: [Project 1-479] Netlist was created with Vivado 2025.1
INFO: [Project 1-570] Preparing netlist for logic optimization
INFO: [Chipscope 16-324] Core: design_1_i/system_ila_0/inst/ila_lib UUID: cd4c83c8-23a6-596d-99ad-09be1335c6b0 
Parsing XDC File [c:/Users/dlnmt/man_bram/man_bram.gen/sources_1/bd/design_1/ip/design_1_proc_sys_reset_0_0/design_1_proc_sys_reset_0_0_board.xdc] for cell 'design_1_i/proc_sys_reset_0/U0'
Finished Parsing XDC File [c:/Users/dlnmt/man_bram/man_bram.gen/sources_1/bd/design_1/ip/design_1_proc_sys_reset_0_0/design_1_proc_sys_reset_0_0_board.xdc] for cell 'design_1_i/proc_sys_reset_0/U0'
Parsing XDC File [c:/Users/dlnmt/man_bram/man_bram.gen/sources_1/bd/design_1/ip/design_1_system_ila_0_2/bd_0/ip/ip_0/ila_v6_2/constraints/ila_impl.xdc] for cell 'design_1_i/system_ila_0/inst/ila_lib/inst'
WARNING: [Vivado_Tcl 4-921] Waiver ID 'CDC-10' -to list should not be empty. [c:/Users/dlnmt/man_bram/man_bram.gen/sources_1/bd/design_1/ip/design_1_system_ila_0_2/bd_0/ip/ip_0/ila_v6_2/constraints/ila_impl.xdc:31]
Finished Parsing XDC File [c:/Users/dlnmt/man_bram/man_bram.gen/sources_1/bd/design_1/ip/design_1_system_ila_0_2/bd_0/ip/ip_0/ila_v6_2/constraints/ila_impl.xdc] for cell 'design_1_i/system_ila_0/inst/ila_lib/inst'
Parsing XDC File [c:/Users/dlnmt/man_bram/man_bram.gen/sources_1/bd/design_1/ip/design_1_system_ila_0_2/bd_0/ip/ip_0/ila_v6_2/constraints/ila.xdc] for cell 'design_1_i/system_ila_0/inst/ila_lib/inst'
WARNING: [Vivado_Tcl 4-921] Waiver ID 'CDC-10' -to list should not be empty. [c:/Users/dlnmt/man_bram/man_bram.gen/sources_1/bd/design_1/ip/design_1_system_ila_0_2/bd_0/ip/ip_0/ila_v6_2/constraints/ila.xdc:108]
Finished Parsing XDC File [c:/Users/dlnmt/man_bram/man_bram.gen/sources_1/bd/design_1/ip/design_1_system_ila_0_2/bd_0/ip/ip_0/ila_v6_2/constraints/ila.xdc] for cell 'design_1_i/system_ila_0/inst/ila_lib/inst'
Parsing XDC File [C:/Users/dlnmt/man_bram/man_bram.srcs/constrs_1/imports/Downloads/Arty-S7-25-Master.xdc]
Finished Parsing XDC File [C:/Users/dlnmt/man_bram/man_bram.srcs/constrs_1/imports/Downloads/Arty-S7-25-Master.xdc]
INFO: [Project 1-1714] 2 XPM XDC files have been applied to the design.
INFO: [Opt 31-138] Pushed 0 inverter(s) to 0 load pin(s).
INFO: [Project 1-1687] 2 scoped IP constraints or related sub-commands were skipped due to synthesis logic optimizations usually triggered by constant connectivity or unconnected output pins. To review the skipped constraints and messages, run the command 'set_param netlist.IPMsgFiltering false' before opening the design.
Netlist sorting complete. Time (s): cpu = 00:00:00 ; elapsed = 00:00:00.001 . Memory (MB): peak = 1326.801 ; gain = 0.000
INFO: [Project 1-111] Unisim Transformation Summary:
  A total of 36 instances were transformed.
  CFGLUT5 => CFGLUT5 (SRL16E, SRLC32E): 36 instances

17 Infos, 2 Warnings, 0 Critical Warnings and 0 Errors encountered.
link_design completed successfully
link_design: Time (s): cpu = 00:00:10 ; elapsed = 00:00:11 . Memory (MB): peak = 1326.801 ; gain = 781.676
Command: opt_design
Attempting to get a license for feature 'Implementation' and/or device 'xc7s25'
INFO: [Common 17-349] Got license for feature 'Implementation' and/or device 'xc7s25'
Running DRC as a precondition to command opt_design

Starting DRC Task
INFO: [DRC 23-27] Running DRC with 2 threads
INFO: [Project 1-461] DRC finished with 0 Errors
INFO: [Project 1-462] Please refer to the DRC report (report_drc) for more information.

Time (s): cpu = 00:00:02 ; elapsed = 00:00:01 . Memory (MB): peak = 1326.801 ; gain = 0.000

Starting Cache Timing Information Task
INFO: [Timing 38-35] Done setting XDC timing constraints.
Ending Cache Timing Information Task | Checksum: 245018b80

Time (s): cpu = 00:00:01 ; elapsed = 00:00:00.094 . Memory (MB): peak = 1356.914 ; gain = 30.113

Starting Logic Optimization Task

Phase 1 Initialization

Phase 1.1 Core Generation And Design Setup

Phase 1.1.1 Generate And Synthesize Debug Cores
INFO: [Chipscope 16-329] Generating Script for core instance : dbg_hub 
INFO: [IP_Flow 19-3806] Processing IP xilinx.com:ip:xsdbm:3.0 for cell dbg_hub_CV.
INFO: [Chipscope 16-469] Using cached IP synthesis design for IP xilinx.com:ip:xsdbm:3.0, cache-ID = 096265f77632604c.
Done building netlist checker database: Time (s): cpu = 00:00:00 ; elapsed = 00:00:00.001 . Memory (MB): peak = 1797.910 ; gain = 0.000
CRITICAL WARNING: [Common 17-55] 'get_property' expects at least one object. [c:/Users/dlnmt/man_bram/man_bram.runs/impl_1/.Xil/Vivado-10616-dylan_pc/dbg_hub_CV.0/out/xsdbm_cc_late_late.xdc:10]
Resolution: If [get_<value>] was used to populate the object, check to make sure this command returns at least one valid object.
CRITICAL WARNING: [Common 17-1548] Command failed: can't read "wr_clk_period": no such variable
 [c:/Users/dlnmt/man_bram/man_bram.runs/impl_1/.Xil/Vivado-10616-dylan_pc/dbg_hub_CV.0/out/xsdbm_cc_late_late.xdc:12]
CRITICAL WARNING: [Common 17-1548] Command failed: can't read "skew_value": no such variable
 [c:/Users/dlnmt/man_bram/man_bram.runs/impl_1/.Xil/Vivado-10616-dylan_pc/dbg_hub_CV.0/out/xsdbm_cc_late_late.xdc:17]
CRITICAL WARNING: [Common 17-55] 'get_property' expects at least one object. [c:/Users/dlnmt/man_bram/man_bram.runs/impl_1/.Xil/Vivado-10616-dylan_pc/dbg_hub_CV.0/out/xsdbm_cc_late_late.xdc:19]
Resolution: If [get_<value>] was used to populate the object, check to make sure this command returns at least one valid object.
CRITICAL WARNING: [Common 17-1548] Command failed: can't read "skew_value": no such variable
 [c:/Users/dlnmt/man_bram/man_bram.runs/impl_1/.Xil/Vivado-10616-dylan_pc/dbg_hub_CV.0/out/xsdbm_cc_late_late.xdc:20]
CRITICAL WARNING: [Common 17-55] 'get_property' expects at least one object. [c:/Users/dlnmt/man_bram/man_bram.runs/impl_1/.Xil/Vivado-10616-dylan_pc/dbg_hub_CV.0/out/xsdbm_cc_late_late.xdc:24]
Resolution: If [get_<value>] was used to populate the object, check to make sure this command returns at least one valid object.
CRITICAL WARNING: [Common 17-1548] Command failed: can't read "rd_clk_period_2": no such variable
 [c:/Users/dlnmt/man_bram/man_bram.runs/impl_1/.Xil/Vivado-10616-dylan_pc/dbg_hub_CV.0/out/xsdbm_cc_late_late.xdc:25]
CRITICAL WARNING: [Common 17-55] 'get_property' expects at least one object. [c:/Users/dlnmt/man_bram/man_bram.runs/impl_1/.Xil/Vivado-10616-dylan_pc/dbg_hub_CV.0/out/xsdbm_cc_late_late.xdc:32]
Resolution: If [get_<value>] was used to populate the object, check to make sure this command returns at least one valid object.
CRITICAL WARNING: [Common 17-1548] Command failed: can't read "skew_value_2": no such variable
 [c:/Users/dlnmt/man_bram/man_bram.runs/impl_1/.Xil/Vivado-10616-dylan_pc/dbg_hub_CV.0/out/xsdbm_cc_late_late.xdc:33]
CRITICAL WARNING: [Common 17-1548] Command failed: can't read "skew_value_2": no such variable
 [c:/Users/dlnmt/man_bram/man_bram.runs/impl_1/.Xil/Vivado-10616-dylan_pc/dbg_hub_CV.0/out/xsdbm_cc_late_late.xdc:36]
Netlist sorting complete. Time (s): cpu = 00:00:00 ; elapsed = 00:00:00.017 . Memory (MB): peak = 1797.910 ; gain = 0.000
Phase 1.1.1 Generate And Synthesize Debug Cores | Checksum: 1c27874c0

Time (s): cpu = 00:00:01 ; elapsed = 00:00:17 . Memory (MB): peak = 1797.910 ; gain = 21.340
Phase 1.1 Core Generation And Design Setup | Checksum: 1c27874c0

Time (s): cpu = 00:00:01 ; elapsed = 00:00:17 . Memory (MB): peak = 1797.910 ; gain = 21.340

Phase 1.2 Setup Constraints And Sort Netlist
Phase 1.2 Setup Constraints And Sort Netlist | Checksum: 1c27874c0

Time (s): cpu = 00:00:01 ; elapsed = 00:00:17 . Memory (MB): peak = 1797.910 ; gain = 21.340
Phase 1 Initialization | Checksum: 1c27874c0

Time (s): cpu = 00:00:01 ; elapsed = 00:00:17 . Memory (MB): peak = 1797.910 ; gain = 21.340

Phase 2 Timer Update And Timing Data Collection

Phase 2.1 Timer Update
Phase 2.1 Timer Update | Checksum: 1c27874c0

Time (s): cpu = 00:00:01 ; elapsed = 00:00:17 . Memory (MB): peak = 1797.910 ; gain = 21.340

Phase 2.2 Timing Data Collection
Phase 2.2 Timing Data Collection | Checksum: 1c27874c0

Time (s): cpu = 00:00:01 ; elapsed = 00:00:17 . Memory (MB): peak = 1797.910 ; gain = 21.340
Phase 2 Timer Update And Timing Data Collection | Checksum: 1c27874c0

Time (s): cpu = 00:00:01 ; elapsed = 00:00:17 . Memory (MB): peak = 1797.910 ; gain = 21.340

Phase 3 Retarget
INFO: [Opt 31-1851] Number of loadless carry chains removed were: 0
INFO: [Opt 31-1834] Total Chains To Be Transformed Were: 0 AND Number of Transformed insts Created are: 0
INFO: [Opt 31-138] Pushed 1 inverter(s) to 1 load pin(s).
INFO: [Opt 31-49] Retargeted 0 cell(s).
Phase 3 Retarget | Checksum: 1930b86a1

Time (s): cpu = 00:00:01 ; elapsed = 00:00:17 . Memory (MB): peak = 1797.910 ; gain = 21.340
Retarget | Checksum: 1930b86a1
INFO: [Opt 31-389] Phase Retarget created 6 cells and removed 16 cells
INFO: [Opt 31-1021] In phase Retarget, 65 netlist objects are constrained preventing optimization. Please run opt_design with -debug_log to get more detail. 

Phase 4 Constant propagation
INFO: [Opt 31-138] Pushed 0 inverter(s) to 0 load pin(s).
Phase 4 Constant propagation | Checksum: 20bb0e58b

Time (s): cpu = 00:00:01 ; elapsed = 00:00:17 . Memory (MB): peak = 1797.910 ; gain = 21.340
Constant propagation | Checksum: 20bb0e58b
INFO: [Opt 31-389] Phase Constant propagation created 0 cells and removed 16 cells
INFO: [Opt 31-1021] In phase Constant propagation, 47 netlist objects are constrained preventing optimization. Please run opt_design with -debug_log to get more detail. 

Phase 5 Sweep
INFO: [Constraints 18-11670] Building netlist checker database with flags, 0x8
Done building netlist checker database: Time (s): cpu = 00:00:00 ; elapsed = 00:00:00.002 . Memory (MB): peak = 1797.910 ; gain = 0.000
INFO: [Constraints 18-11670] Building netlist checker database with flags, 0x8
Done building netlist checker database: Time (s): cpu = 00:00:00 ; elapsed = 00:00:00.002 . Memory (MB): peak = 1797.910 ; gain = 0.000
Phase 5 Sweep | Checksum: 14be7516d

Time (s): cpu = 00:00:01 ; elapsed = 00:00:17 . Memory (MB): peak = 1797.910 ; gain = 21.340
Sweep | Checksum: 14be7516d
INFO: [Opt 31-389] Phase Sweep created 0 cells and removed 63 cells
INFO: [Opt 31-1021] In phase Sweep, 887 netlist objects are constrained preventing optimization. Please run opt_design with -debug_log to get more detail. 

Phase 6 BUFG optimization
INFO: [Opt 31-194] Inserted BUFG clk_in1_0_IBUF_BUFG_inst to drive 1654 load(s) on clock net clk_in1_0_IBUF_BUFG
INFO: [Opt 31-193] Inserted 1 BUFG(s) on clock nets
Phase 6 BUFG optimization | Checksum: 12f45c026

Time (s): cpu = 00:00:01 ; elapsed = 00:00:17 . Memory (MB): peak = 1797.910 ; gain = 21.340
BUFG optimization | Checksum: 12f45c026
INFO: [Opt 31-662] Phase BUFG optimization created 1 cells of which 1 are BUFGs and removed 0 cells.

Phase 7 Shift Register Optimization
INFO: [Opt 31-1064] SRL Remap converted 0 SRLs to 0 registers and converted 0 registers of register chains to 0 SRLs
Phase 7 Shift Register Optimization | Checksum: 12f45c026

Time (s): cpu = 00:00:01 ; elapsed = 00:00:17 . Memory (MB): peak = 1797.910 ; gain = 21.340
Shift Register Optimization | Checksum: 12f45c026
INFO: [Opt 31-389] Phase Shift Register Optimization created 0 cells and removed 0 cells

Phase 8 Post Processing Netlist
Phase 8 Post Processing Netlist | Checksum: 12f45c026

Time (s): cpu = 00:00:01 ; elapsed = 00:00:17 . Memory (MB): peak = 1797.910 ; gain = 21.340
Post Processing Netlist | Checksum: 12f45c026
INFO: [Opt 31-389] Phase Post Processing Netlist created 0 cells and removed 0 cells
INFO: [Opt 31-1021] In phase Post Processing Netlist, 57 netlist objects are constrained preventing optimization. Please run opt_design with -debug_log to get more detail. 

Phase 9 Finalization

Phase 9.1 Finalizing Design Cores and Updating Shapes
Phase 9.1 Finalizing Design Cores and Updating Shapes | Checksum: 15fef26c8

Time (s): cpu = 00:00:01 ; elapsed = 00:00:17 . Memory (MB): peak = 1797.910 ; gain = 21.340

Phase 9.2 Verifying Netlist Connectivity

Starting Connectivity Check Task

Time (s): cpu = 00:00:00 ; elapsed = 00:00:00.014 . Memory (MB): peak = 1797.910 ; gain = 0.000
Phase 9.2 Verifying Netlist Connectivity | Checksum: 15fef26c8

Time (s): cpu = 00:00:01 ; elapsed = 00:00:17 . Memory (MB): peak = 1797.910 ; gain = 21.340
Phase 9 Finalization | Checksum: 15fef26c8

Time (s): cpu = 00:00:01 ; elapsed = 00:00:17 . Memory (MB): peak = 1797.910 ; gain = 21.340
Opt_design Change Summary
=========================


-------------------------------------------------------------------------------------------------------------------------
|  Phase                        |  #Cells created  |  #Cells Removed  |  #Constrained objects preventing optimizations  |
-------------------------------------------------------------------------------------------------------------------------
|  Retarget                     |               6  |              16  |                                             65  |
|  Constant propagation         |               0  |              16  |                                             47  |
|  Sweep                        |               0  |              63  |                                            887  |
|  BUFG optimization            |               1  |               0  |                                              0  |
|  Shift Register Optimization  |               0  |               0  |                                              0  |
|  Post Processing Netlist      |               0  |               0  |                                             57  |
-------------------------------------------------------------------------------------------------------------------------


Ending Logic Optimization Task | Checksum: 15fef26c8

Time (s): cpu = 00:00:01 ; elapsed = 00:00:17 . Memory (MB): peak = 1797.910 ; gain = 21.340

Starting Power Optimization Task
INFO: [Pwropt 34-132] Skipping clock gating for clocks with a period < 2.00 ns.
INFO: [Timing 38-35] Done setting XDC timing constraints.
Running Vector-less Activity Propagation...

Finished Running Vector-less Activity Propagation
INFO: [Pwropt 34-9] Applying IDT optimizations ...
INFO: [Pwropt 34-10] Applying ODC optimizations ...


Starting PowerOpt Patch Enables Task
INFO: [Pwropt 34-162] WRITE_MODE attribute of 0 BRAM(s) out of a total of 18 has been updated to save power. Run report_power_opt to get a complete listing of the BRAMs updated.
INFO: [Pwropt 34-201] Structural ODC has moved 0 WE to EN ports
Number of BRAM Ports augmented: 37 newly gated: 0 Total Ports: 36
Number of Flops added for Enable Generation: 1

Ending PowerOpt Patch Enables Task | Checksum: 27a99de35

Time (s): cpu = 00:00:00 ; elapsed = 00:00:00.115 . Memory (MB): peak = 1881.762 ; gain = 0.000
Ending Power Optimization Task | Checksum: 27a99de35

Time (s): cpu = 00:00:04 ; elapsed = 00:00:02 . Memory (MB): peak = 1881.762 ; gain = 83.852

Starting Final Cleanup Task

Starting Logic Optimization Task
INFO: [Timing 38-35] Done setting XDC timing constraints.
Ending Logic Optimization Task | Checksum: 22d87b20f

Time (s): cpu = 00:00:00 ; elapsed = 00:00:00.275 . Memory (MB): peak = 1881.762 ; gain = 0.000
Ending Final Cleanup Task | Checksum: 22d87b20f

Time (s): cpu = 00:00:03 ; elapsed = 00:00:04 . Memory (MB): peak = 1881.762 ; gain = 0.000

Starting Netlist Obfuscation Task
Netlist sorting complete. Time (s): cpu = 00:00:00 ; elapsed = 00:00:00.003 . Memory (MB): peak = 1881.762 ; gain = 0.000
Ending Netlist Obfuscation Task | Checksum: 22d87b20f

Time (s): cpu = 00:00:00 ; elapsed = 00:00:00.004 . Memory (MB): peak = 1881.762 ; gain = 0.000
INFO: [Common 17-83] Releasing license: Implementation
60 Infos, 4 Warnings, 10 Critical Warnings and 0 Errors encountered.
opt_design completed successfully
opt_design: Time (s): cpu = 00:00:14 ; elapsed = 00:00:28 . Memory (MB): peak = 1881.762 ; gain = 554.961
INFO: [Vivado 12-24828] Executing command : report_drc -file design_1_wrapper_drc_opted.rpt -pb design_1_wrapper_drc_opted.pb -rpx design_1_wrapper_drc_opted.rpx
Command: report_drc -file design_1_wrapper_drc_opted.rpt -pb design_1_wrapper_drc_opted.pb -rpx design_1_wrapper_drc_opted.rpx
INFO: [IP_Flow 19-1839] IP Catalog is up to date.
INFO: [DRC 23-27] Running DRC with 2 threads
INFO: [Vivado_Tcl 2-168] The results of DRC are in file C:/Users/dlnmt/man_bram/man_bram.runs/impl_1/design_1_wrapper_drc_opted.rpt.
report_drc completed successfully
INFO: [Timing 38-35] Done setting XDC timing constraints.
INFO: [Timing 38-480] Writing timing data to binary archive.
Wrote PlaceDB: Time (s): cpu = 00:00:00 ; elapsed = 00:00:00 . Memory (MB): peak = 1881.762 ; gain = 0.000
Wrote PulsedLatchDB: Time (s): cpu = 00:00:00 ; elapsed = 00:00:00.001 . Memory (MB): peak = 1881.762 ; gain = 0.000
Writing XDEF routing.
Write ShapeDB Complete: Time (s): cpu = 00:00:00 ; elapsed = 00:00:00.007 . Memory (MB): peak = 1881.762 ; gain = 0.000
Writing XDEF routing logical nets.
Writing XDEF routing special nets.
Wrote RouteStorage: Time (s): cpu = 00:00:00 ; elapsed = 00:00:00.021 . Memory (MB): peak = 1881.762 ; gain = 0.000
Wrote Netlist Cache: Time (s): cpu = 00:00:00 ; elapsed = 00:00:00 . Memory (MB): peak = 1881.762 ; gain = 0.000
Wrote Device Cache: Time (s): cpu = 00:00:00 ; elapsed = 00:00:00.009 . Memory (MB): peak = 1881.762 ; gain = 0.000
Write Physdb Complete: Time (s): cpu = 00:00:00 ; elapsed = 00:00:00.038 . Memory (MB): peak = 1881.762 ; gain = 0.000
INFO: [Common 17-1381] The checkpoint 'C:/Users/dlnmt/man_bram/man_bram.runs/impl_1/design_1_wrapper_opt.dcp' has been generated.
INFO: [Chipscope 16-240] Debug cores have already been implemented
Command: place_design
Attempting to get a license for feature 'Implementation' and/or device 'xc7s25'
INFO: [Common 17-349] Got license for feature 'Implementation' and/or device 'xc7s25'
INFO: [Common 17-83] Releasing license: Implementation
INFO: [DRC 23-27] Running DRC with 2 threads
INFO: [Vivado_Tcl 4-198] DRC finished with 0 Errors
INFO: [Vivado_Tcl 4-199] Please refer to the DRC report (report_drc) for more information.
Running DRC as a precondition to command place_design
INFO: [DRC 23-27] Running DRC with 2 threads
INFO: [Vivado_Tcl 4-198] DRC finished with 0 Errors
INFO: [Vivado_Tcl 4-199] Please refer to the DRC report (report_drc) for more information.
INFO: [Place 30-611] Multithreading enabled for place_design using a maximum of 2 CPUs

Starting Placer Task

Phase 1 Placer Initialization

Phase 1.1 Placer Initialization Netlist Sorting
Netlist sorting complete. Time (s): cpu = 00:00:00 ; elapsed = 00:00:00.003 . Memory (MB): peak = 1881.762 ; gain = 0.000
Phase 1.1 Placer Initialization Netlist Sorting | Checksum: 1563bb51c

Time (s): cpu = 00:00:00 ; elapsed = 00:00:00.010 . Memory (MB): peak = 1881.762 ; gain = 0.000
Netlist sorting complete. Time (s): cpu = 00:00:00 ; elapsed = 00:00:00.002 . Memory (MB): peak = 1881.762 ; gain = 0.000

Phase 1.2 IO Placement/ Clock Placement/ Build Placer Device
Phase 1.2 IO Placement/ Clock Placement/ Build Placer Device | Checksum: 2297687cb

Time (s): cpu = 00:00:01 ; elapsed = 00:00:00.346 . Memory (MB): peak = 1881.762 ; gain = 0.000

Phase 1.3 Build Placer Netlist Model
Phase 1.3 Build Placer Netlist Model | Checksum: 2f3fe1ae0

Time (s): cpu = 00:00:02 ; elapsed = 00:00:00.899 . Memory (MB): peak = 1881.762 ; gain = 0.000

Phase 1.4 Constrain Clocks/Macros
Phase 1.4 Constrain Clocks/Macros | Checksum: 2f3fe1ae0

Time (s): cpu = 00:00:02 ; elapsed = 00:00:00.909 . Memory (MB): peak = 1881.762 ; gain = 0.000
Phase 1 Placer Initialization | Checksum: 2f3fe1ae0

Time (s): cpu = 00:00:02 ; elapsed = 00:00:00.931 . Memory (MB): peak = 1881.762 ; gain = 0.000

Phase 2 Global Placement

Phase 2.1 Floorplanning
Phase 2.1 Floorplanning | Checksum: 21b729cd2

Time (s): cpu = 00:00:02 ; elapsed = 00:00:01 . Memory (MB): peak = 1881.762 ; gain = 0.000

Phase 2.2 Update Timing before SLR Path Opt
Phase 2.2 Update Timing before SLR Path Opt | Checksum: 2644402eb

Time (s): cpu = 00:00:02 ; elapsed = 00:00:01 . Memory (MB): peak = 1881.762 ; gain = 0.000

Phase 2.3 Post-Processing in Floorplanning
Phase 2.3 Post-Processing in Floorplanning | Checksum: 2644402eb

Time (s): cpu = 00:00:02 ; elapsed = 00:00:01 . Memory (MB): peak = 1881.762 ; gain = 0.000

Phase 2.4 Global Place Phase1
Phase 2.4 Global Place Phase1 | Checksum: 23184a05f

Time (s): cpu = 00:00:03 ; elapsed = 00:00:02 . Memory (MB): peak = 1881.762 ; gain = 0.000

Phase 2.5 Global Place Phase2

Phase 2.5.1 UpdateTiming Before Physical Synthesis
Phase 2.5.1 UpdateTiming Before Physical Synthesis | Checksum: 23184a05f

Time (s): cpu = 00:00:04 ; elapsed = 00:00:02 . Memory (MB): peak = 1881.762 ; gain = 0.000

Phase 2.5.2 Physical Synthesis In Placer
INFO: [Physopt 32-1035] Found 0 LUTNM shape to break, 161 LUT instances to create LUTNM shape
INFO: [Physopt 32-1044] Break lutnm for timing: one critical 0, two critical 0, total 0, new lutff created 0
INFO: [Physopt 32-1138] End 1 Pass. Optimized 71 nets or LUTs. Breaked 0 LUT, combined 71 existing LUTs and moved 0 existing LUT
INFO: [Physopt 32-65] No nets found for high-fanout optimization.
INFO: [Physopt 32-232] Optimized 0 net. Created 0 new instance.
INFO: [Physopt 32-775] End 1 Pass. Optimized 0 net or cell. Created 0 new cell, deleted 0 existing cell and moved 0 existing cell
INFO: [Physopt 32-670] No setup violation found.  DSP Register Optimization was not performed.
INFO: [Physopt 32-670] No setup violation found.  Shift Register to Pipeline Optimization was not performed.
INFO: [Physopt 32-670] No setup violation found.  Shift Register Optimization was not performed.
INFO: [Physopt 32-670] No setup violation found.  BRAM Register Optimization was not performed.
INFO: [Physopt 32-670] No setup violation found.  URAM Register Optimization was not performed.
INFO: [Physopt 32-949] No candidate nets found for dynamic/static region interface net replication
INFO: [Physopt 32-775] End 1 Pass. Optimized 0 net or cell. Created 0 new cell, deleted 0 existing cell and moved 0 existing cell
Netlist sorting complete. Time (s): cpu = 00:00:00 ; elapsed = 00:00:00.002 . Memory (MB): peak = 1881.762 ; gain = 0.000

Summary of Physical Synthesis Optimizations
============================================


-----------------------------------------------------------------------------------------------------------------------------------------------------------
|  Optimization                                     |  Added Cells  |  Removed Cells  |  Optimized Cells/Nets  |  Dont Touch  |  Iterations  |  Elapsed   |
-----------------------------------------------------------------------------------------------------------------------------------------------------------
|  LUT Combining                                    |            0  |             71  |                    71  |           0  |           1  |  00:00:00  |
|  Retime                                           |            0  |              0  |                     0  |           0  |           1  |  00:00:00  |
|  Very High Fanout                                 |            0  |              0  |                     0  |           0  |           1  |  00:00:00  |
|  DSP Register                                     |            0  |              0  |                     0  |           0  |           0  |  00:00:00  |
|  Shift Register to Pipeline                       |            0  |              0  |                     0  |           0  |           0  |  00:00:00  |
|  Shift Register                                   |            0  |              0  |                     0  |           0  |           0  |  00:00:00  |
|  BRAM Register                                    |            0  |              0  |                     0  |           0  |           0  |  00:00:00  |
|  URAM Register                                    |            0  |              0  |                     0  |           0  |           0  |  00:00:00  |
|  Dynamic/Static Region Interface Net Replication  |            0  |              0  |                     0  |           0  |           1  |  00:00:00  |
|  Total                                            |            0  |             71  |                    71  |           0  |           4  |  00:00:00  |
-----------------------------------------------------------------------------------------------------------------------------------------------------------


Phase 2.5.2 Physical Synthesis In Placer | Checksum: 276d2a6da

Time (s): cpu = 00:00:04 ; elapsed = 00:00:02 . Memory (MB): peak = 1881.762 ; gain = 0.000
Phase 2.5 Global Place Phase2 | Checksum: 26110dd6b

Time (s): cpu = 00:00:04 ; elapsed = 00:00:03 . Memory (MB): peak = 1881.762 ; gain = 0.000
Phase 2 Global Placement | Checksum: 26110dd6b

Time (s): cpu = 00:00:04 ; elapsed = 00:00:03 . Memory (MB): peak = 1881.762 ; gain = 0.000

Phase 3 Detail Placement

Phase 3.1 Commit Multi Column Macros
Phase 3.1 Commit Multi Column Macros | Checksum: 27cd0caaa

Time (s): cpu = 00:00:04 ; elapsed = 00:00:03 . Memory (MB): peak = 1881.762 ; gain = 0.000

Phase 3.2 Commit Most Macros & LUTRAMs
Phase 3.2 Commit Most Macros & LUTRAMs | Checksum: 210138f73

Time (s): cpu = 00:00:05 ; elapsed = 00:00:03 . Memory (MB): peak = 1881.762 ; gain = 0.000

Phase 3.3 Area Swap Optimization
Phase 3.3 Area Swap Optimization | Checksum: 273fbd08d

Time (s): cpu = 00:00:05 ; elapsed = 00:00:03 . Memory (MB): peak = 1881.762 ; gain = 0.000

Phase 3.4 Pipeline Register Optimization
Phase 3.4 Pipeline Register Optimization | Checksum: 28b25fe67

Time (s): cpu = 00:00:05 ; elapsed = 00:00:03 . Memory (MB): peak = 1881.762 ; gain = 0.000

Phase 3.5 Small Shape Detail Placement
Phase 3.5 Small Shape Detail Placement | Checksum: 222c700e7

Time (s): cpu = 00:00:05 ; elapsed = 00:00:04 . Memory (MB): peak = 1881.762 ; gain = 0.000

Phase 3.6 Re-assign LUT pins
Phase 3.6 Re-assign LUT pins | Checksum: 17a8537ee

Time (s): cpu = 00:00:06 ; elapsed = 00:00:04 . Memory (MB): peak = 1881.762 ; gain = 0.000

Phase 3.7 Pipeline Register Optimization
Phase 3.7 Pipeline Register Optimization | Checksum: 1815ac9cc

Time (s): cpu = 00:00:06 ; elapsed = 00:00:04 . Memory (MB): peak = 1881.762 ; gain = 0.000
Phase 3 Detail Placement | Checksum: 1815ac9cc

Time (s): cpu = 00:00:06 ; elapsed = 00:00:04 . Memory (MB): peak = 1881.762 ; gain = 0.000

Phase 4 Post Placement Optimization and Clean-Up

Phase 4.1 Post Commit Optimization
INFO: [Timing 38-35] Done setting XDC timing constraints.

Phase 4.1.1 Post Placement Optimization
Post Placement Optimization Initialization | Checksum: 142aa4689

Phase 4.1.1.1 BUFG Insertion

Starting Physical Synthesis Task

Phase 1 Physical Synthesis Initialization
INFO: [Physopt 32-721] Multithreading enabled for phys_opt_design using a maximum of 2 CPUs
INFO: [Physopt 32-619] Estimated Timing Summary | WNS=27.484 | TNS=0.000 |
Phase 1 Physical Synthesis Initialization | Checksum: 12a312056

Time (s): cpu = 00:00:00 ; elapsed = 00:00:00.037 . Memory (MB): peak = 1881.762 ; gain = 0.000
INFO: [Place 46-56] BUFG insertion identified 0 candidate nets. Inserted BUFG: 0, Replicated BUFG Driver: 0, Skipped due to Placement/Routing Conflicts: 0, Skipped due to Timing Degradation: 0, Skipped due to netlist editing failed: 0.
Ending Physical Synthesis Task | Checksum: 1ee72ba5f

Time (s): cpu = 00:00:00 ; elapsed = 00:00:00.064 . Memory (MB): peak = 1881.762 ; gain = 0.000
Phase 4.1.1.1 BUFG Insertion | Checksum: 142aa4689

Time (s): cpu = 00:00:06 ; elapsed = 00:00:04 . Memory (MB): peak = 1881.762 ; gain = 0.000

Phase 4.1.1.2 Post Placement Timing Optimization
INFO: [Place 30-746] Post Placement Timing Summary WNS=27.484. For the most accurate timing information please run report_timing.
Phase 4.1.1.2 Post Placement Timing Optimization | Checksum: 19de8db7a

Time (s): cpu = 00:00:06 ; elapsed = 00:00:04 . Memory (MB): peak = 1881.762 ; gain = 0.000

Time (s): cpu = 00:00:06 ; elapsed = 00:00:04 . Memory (MB): peak = 1881.762 ; gain = 0.000
Phase 4.1 Post Commit Optimization | Checksum: 19de8db7a

Time (s): cpu = 00:00:06 ; elapsed = 00:00:04 . Memory (MB): peak = 1881.762 ; gain = 0.000

Phase 4.2 Post Placement Cleanup
Phase 4.2 Post Placement Cleanup | Checksum: 19de8db7a

Time (s): cpu = 00:00:07 ; elapsed = 00:00:04 . Memory (MB): peak = 1881.762 ; gain = 0.000

Phase 4.3 Placer Reporting

Phase 4.3.1 Print Estimated Congestion
INFO: [Place 30-612] Post-Placement Estimated Congestion 
 ____________________________________________________
|           | Global Congestion | Short Congestion  |
| Direction | Region Size       | Region Size       |
|___________|___________________|___________________|
|      North|                1x1|                1x1|
|___________|___________________|___________________|
|      South|                1x1|                1x1|
|___________|___________________|___________________|
|       East|                1x1|                1x1|
|___________|___________________|___________________|
|       West|                1x1|                1x1|
|___________|___________________|___________________|

Phase 4.3.1 Print Estimated Congestion | Checksum: 19de8db7a

Time (s): cpu = 00:00:07 ; elapsed = 00:00:04 . Memory (MB): peak = 1881.762 ; gain = 0.000
Phase 4.3 Placer Reporting | Checksum: 19de8db7a

Time (s): cpu = 00:00:07 ; elapsed = 00:00:04 . Memory (MB): peak = 1881.762 ; gain = 0.000

Phase 4.4 Final Placement Cleanup
Netlist sorting complete. Time (s): cpu = 00:00:00 ; elapsed = 00:00:00.003 . Memory (MB): peak = 1881.762 ; gain = 0.000

Time (s): cpu = 00:00:07 ; elapsed = 00:00:04 . Memory (MB): peak = 1881.762 ; gain = 0.000
Phase 4 Post Placement Optimization and Clean-Up | Checksum: 1b198ebe8

Time (s): cpu = 00:00:07 ; elapsed = 00:00:05 . Memory (MB): peak = 1881.762 ; gain = 0.000
Ending Placer Task | Checksum: 12ad6cdda

Time (s): cpu = 00:00:07 ; elapsed = 00:00:05 . Memory (MB): peak = 1881.762 ; gain = 0.000
96 Infos, 4 Warnings, 10 Critical Warnings and 0 Errors encountered.
place_design completed successfully
place_design: Time (s): cpu = 00:00:09 ; elapsed = 00:00:06 . Memory (MB): peak = 1881.762 ; gain = 0.000
INFO: [Vivado 12-24838] Running report commands "report_control_sets, report_io, report_utilization" in parallel.
Running report generation with 2 threads.
INFO: [Vivado 12-24828] Executing command : report_utilization -file design_1_wrapper_utilization_placed.rpt -pb design_1_wrapper_utilization_placed.pb
INFO: [Vivado 12-24828] Executing command : report_io -file design_1_wrapper_io_placed.rpt
report_io: Time (s): cpu = 00:00:00 ; elapsed = 00:00:00.067 . Memory (MB): peak = 1881.762 ; gain = 0.000
INFO: [Vivado 12-24828] Executing command : report_control_sets -verbose -file design_1_wrapper_control_sets_placed.rpt
report_control_sets: Time (s): cpu = 00:00:00 ; elapsed = 00:00:00.017 . Memory (MB): peak = 1881.762 ; gain = 0.000
INFO: [Timing 38-480] Writing timing data to binary archive.
Write ShapeDB Complete: Time (s): cpu = 00:00:00 ; elapsed = 00:00:00.014 . Memory (MB): peak = 1881.762 ; gain = 0.000
Wrote PlaceDB: Time (s): cpu = 00:00:01 ; elapsed = 00:00:00.275 . Memory (MB): peak = 1881.762 ; gain = 0.000
Wrote PulsedLatchDB: Time (s): cpu = 00:00:00 ; elapsed = 00:00:00 . Memory (MB): peak = 1881.762 ; gain = 0.000
Writing XDEF routing.
Writing XDEF routing logical nets.
Writing XDEF routing special nets.
Wrote RouteStorage: Time (s): cpu = 00:00:00 ; elapsed = 00:00:00.014 . Memory (MB): peak = 1881.762 ; gain = 0.000
Wrote Netlist Cache: Time (s): cpu = 00:00:00 ; elapsed = 00:00:00.005 . Memory (MB): peak = 1881.762 ; gain = 0.000
Wrote Device Cache: Time (s): cpu = 00:00:00 ; elapsed = 00:00:00.006 . Memory (MB): peak = 1881.762 ; gain = 0.000
Write Physdb Complete: Time (s): cpu = 00:00:01 ; elapsed = 00:00:00.306 . Memory (MB): peak = 1881.762 ; gain = 0.000
INFO: [Common 17-1381] The checkpoint 'C:/Users/dlnmt/man_bram/man_bram.runs/impl_1/design_1_wrapper_placed.dcp' has been generated.
Command: phys_opt_design
Attempting to get a license for feature 'Implementation' and/or device 'xc7s25'
INFO: [Common 17-349] Got license for feature 'Implementation' and/or device 'xc7s25'

Starting Initial Update Timing Task

Time (s): cpu = 00:00:00 ; elapsed = 00:00:00.190 . Memory (MB): peak = 1881.762 ; gain = 0.000
INFO: [Vivado_Tcl 4-2279] Estimated Timing Summary | WNS= 27.484 | TNS= 0.000 | 
INFO: [Vivado_Tcl 4-383] Design worst setup slack (WNS) is greater than or equal to 0.000 ns. All physical synthesis setup optimizations will be skipped.
INFO: [Vivado_Tcl 4-232] No setup violation found. The netlist was not modified.
INFO: [Common 17-83] Releasing license: Implementation
107 Infos, 4 Warnings, 10 Critical Warnings and 0 Errors encountered.
phys_opt_design completed successfully
INFO: [Timing 38-480] Writing timing data to binary archive.
Write ShapeDB Complete: Time (s): cpu = 00:00:00 ; elapsed = 00:00:00.012 . Memory (MB): peak = 1888.980 ; gain = 7.219
Wrote PlaceDB: Time (s): cpu = 00:00:01 ; elapsed = 00:00:00.283 . Memory (MB): peak = 1894.359 ; gain = 12.598
Wrote PulsedLatchDB: Time (s): cpu = 00:00:00 ; elapsed = 00:00:00 . Memory (MB): peak = 1894.359 ; gain = 0.000
Writing XDEF routing.
Writing XDEF routing logical nets.
Writing XDEF routing special nets.
Wrote RouteStorage: Time (s): cpu = 00:00:00 ; elapsed = 00:00:00.014 . Memory (MB): peak = 1894.359 ; gain = 0.000
Wrote Netlist Cache: Time (s): cpu = 00:00:00 ; elapsed = 00:00:00.004 . Memory (MB): peak = 1894.359 ; gain = 0.000
Wrote Device Cache: Time (s): cpu = 00:00:00 ; elapsed = 00:00:00.006 . Memory (MB): peak = 1894.359 ; gain = 0.000
Write Physdb Complete: Time (s): cpu = 00:00:01 ; elapsed = 00:00:00.314 . Memory (MB): peak = 1894.359 ; gain = 12.598
INFO: [Common 17-1381] The checkpoint 'C:/Users/dlnmt/man_bram/man_bram.runs/impl_1/design_1_wrapper_physopt.dcp' has been generated.
Command: route_design
Attempting to get a license for feature 'Implementation' and/or device 'xc7s25'
INFO: [Common 17-349] Got license for feature 'Implementation' and/or device 'xc7s25'


Starting Routing Task
INFO: [Route 35-254] Multithreading enabled for route_design using a maximum of 2 CPUs

Phase 1 Build RT Design
Checksum: PlaceDB: 1d51f841 ConstDB: 0 ShapeSum: 3b11aab4 RouteDB: d2732ae5
Post Restoration Checksum: NetGraph: 917a607f | NumContArr: ca6580d6 | Constraints: c2a8fa9d | Timing: c2a8fa9d
Phase 1 Build RT Design | Checksum: 2e131d68f

Time (s): cpu = 00:00:15 ; elapsed = 00:00:14 . Memory (MB): peak = 1921.797 ; gain = 27.438

Phase 2 Router Initialization

Phase 2.1 Fix Topology Constraints
Phase 2.1 Fix Topology Constraints | Checksum: 2e131d68f

Time (s): cpu = 00:00:15 ; elapsed = 00:00:14 . Memory (MB): peak = 1921.797 ; gain = 27.438

Phase 2.2 Pre Route Cleanup
Phase 2.2 Pre Route Cleanup | Checksum: 2e131d68f

Time (s): cpu = 00:00:15 ; elapsed = 00:00:14 . Memory (MB): peak = 1921.797 ; gain = 27.438
 Number of Nodes with overlaps = 0

Phase 2.3 Update Timing
Phase 2.3 Update Timing | Checksum: 1228ea943

Time (s): cpu = 00:00:16 ; elapsed = 00:00:14 . Memory (MB): peak = 1950.246 ; gain = 55.887
INFO: [Route 35-416] Intermediate Timing Summary | WNS=27.471 | TNS=0.000  | WHS=-0.202 | THS=-20.296|


Phase 2.4 Soft Constraint Pins - Fast Budgeting
Phase 2.4 Soft Constraint Pins - Fast Budgeting | Checksum: 1481d2ffe

Time (s): cpu = 00:00:16 ; elapsed = 00:00:14 . Memory (MB): peak = 1974.285 ; gain = 79.926

Router Utilization Summary
  Global Vertical Routing Utilization    = 0 %
  Global Horizontal Routing Utilization  = 0 %
  Routable Net Status*
  *Does not include unroutable nets such as driverless and loadless.
  Run report_route_status for detailed report.
  Number of Failed Nets               = 2911
    (Failed Nets is the sum of unrouted and partially routed nets)
  Number of Unrouted Nets             = 2911
  Number of Partially Routed Nets     = 0
  Number of Node Overlaps             = 0

Phase 2 Router Initialization | Checksum: 13ec3dc33

Time (s): cpu = 00:00:16 ; elapsed = 00:00:15 . Memory (MB): peak = 1974.285 ; gain = 79.926

Phase 3 Global Routing
Phase 3 Global Routing | Checksum: 13ec3dc33

Time (s): cpu = 00:00:16 ; elapsed = 00:00:15 . Memory (MB): peak = 1974.285 ; gain = 79.926

Phase 4 Initial Routing

Phase 4.1 Initial Net Routing Pass
Phase 4.1 Initial Net Routing Pass | Checksum: 1213936bd

Time (s): cpu = 00:00:17 ; elapsed = 00:00:15 . Memory (MB): peak = 1974.285 ; gain = 79.926
Phase 4 Initial Routing | Checksum: 1213936bd

Time (s): cpu = 00:00:17 ; elapsed = 00:00:15 . Memory (MB): peak = 1974.285 ; gain = 79.926

Phase 5 Rip-up And Reroute

Phase 5.1 Global Iteration 0
 Number of Nodes with overlaps = 118
 Number of Nodes with overlaps = 0
INFO: [Route 35-416] Intermediate Timing Summary | WNS=26.763 | TNS=0.000  | WHS=N/A    | THS=N/A    |

Phase 5.1 Global Iteration 0 | Checksum: 1c117f1af

Time (s): cpu = 00:00:18 ; elapsed = 00:00:16 . Memory (MB): peak = 1974.285 ; gain = 79.926

Phase 5.2 Global Iteration 1
 Number of Nodes with overlaps = 2
 Number of Nodes with overlaps = 0
INFO: [Route 35-416] Intermediate Timing Summary | WNS=26.763 | TNS=0.000  | WHS=N/A    | THS=N/A    |

Phase 5.2 Global Iteration 1 | Checksum: 31307104f

Time (s): cpu = 00:00:18 ; elapsed = 00:00:16 . Memory (MB): peak = 1974.285 ; gain = 79.926
Phase 5 Rip-up And Reroute | Checksum: 31307104f

Time (s): cpu = 00:00:18 ; elapsed = 00:00:16 . Memory (MB): peak = 1974.285 ; gain = 79.926

Phase 6 Delay and Skew Optimization

Phase 6.1 Delay CleanUp
Phase 6.1 Delay CleanUp | Checksum: 31307104f

Time (s): cpu = 00:00:18 ; elapsed = 00:00:16 . Memory (MB): peak = 1974.285 ; gain = 79.926

Phase 6.2 Clock Skew Optimization
Phase 6.2 Clock Skew Optimization | Checksum: 31307104f

Time (s): cpu = 00:00:18 ; elapsed = 00:00:16 . Memory (MB): peak = 1974.285 ; gain = 79.926
Phase 6 Delay and Skew Optimization | Checksum: 31307104f

Time (s): cpu = 00:00:18 ; elapsed = 00:00:16 . Memory (MB): peak = 1974.285 ; gain = 79.926

Phase 7 Post Hold Fix

Phase 7.1 Hold Fix Iter
INFO: [Route 35-416] Intermediate Timing Summary | WNS=26.770 | TNS=0.000  | WHS=0.049  | THS=0.000  |

Phase 7.1 Hold Fix Iter | Checksum: 259b26a60

Time (s): cpu = 00:00:18 ; elapsed = 00:00:16 . Memory (MB): peak = 1974.285 ; gain = 79.926
Phase 7 Post Hold Fix | Checksum: 259b26a60

Time (s): cpu = 00:00:18 ; elapsed = 00:00:16 . Memory (MB): peak = 1974.285 ; gain = 79.926

Phase 8 Route finalize

Router Utilization Summary
  Global Vertical Routing Utilization    = 1.35024 %
  Global Horizontal Routing Utilization  = 1.72704 %
  Routable Net Status*
  *Does not include unroutable nets such as driverless and loadless.
  Run report_route_status for detailed report.
  Number of Failed Nets               = 0
    (Failed Nets is the sum of unrouted and partially routed nets)
  Number of Unrouted Nets             = 0
  Number of Partially Routed Nets     = 0
  Number of Node Overlaps             = 0

Phase 8 Route finalize | Checksum: 259b26a60

Time (s): cpu = 00:00:18 ; elapsed = 00:00:16 . Memory (MB): peak = 1974.285 ; gain = 79.926

Phase 9 Verifying routed nets

 Verification completed successfully
Phase 9 Verifying routed nets | Checksum: 259b26a60

Time (s): cpu = 00:00:18 ; elapsed = 00:00:16 . Memory (MB): peak = 1974.285 ; gain = 79.926

Phase 10 Depositing Routes
Phase 10 Depositing Routes | Checksum: 1da01db13

Time (s): cpu = 00:00:18 ; elapsed = 00:00:16 . Memory (MB): peak = 1974.285 ; gain = 79.926

Phase 11 Post Process Routing
Phase 11 Post Process Routing | Checksum: 1da01db13

Time (s): cpu = 00:00:18 ; elapsed = 00:00:16 . Memory (MB): peak = 1974.285 ; gain = 79.926

Phase 12 Post Router Timing
INFO: [Route 35-57] Estimated Timing Summary | WNS=26.770 | TNS=0.000  | WHS=0.049  | THS=0.000  |

INFO: [Route 35-327] The final timing numbers are based on the router estimated timing analysis. For a complete and accurate timing signoff, please run report_timing_summary.
Phase 12 Post Router Timing | Checksum: 1da01db13

Time (s): cpu = 00:00:18 ; elapsed = 00:00:16 . Memory (MB): peak = 1974.285 ; gain = 79.926
Total Elapsed time in route_design: 16.134 secs

Phase 13 Post-Route Event Processing
Phase 13 Post-Route Event Processing | Checksum: 9e706fac

Time (s): cpu = 00:00:18 ; elapsed = 00:00:16 . Memory (MB): peak = 1974.285 ; gain = 79.926
INFO: [Route 35-16] Router Completed Successfully
Ending Routing Task | Checksum: 9e706fac

Time (s): cpu = 00:00:18 ; elapsed = 00:00:16 . Memory (MB): peak = 1974.285 ; gain = 79.926

Routing Is Done.
INFO: [Common 17-83] Releasing license: Implementation
119 Infos, 4 Warnings, 10 Critical Warnings and 0 Errors encountered.
route_design completed successfully
route_design: Time (s): cpu = 00:00:18 ; elapsed = 00:00:16 . Memory (MB): peak = 1974.285 ; gain = 79.926
INFO: [Vivado 12-24828] Executing command : report_drc -file design_1_wrapper_drc_routed.rpt -pb design_1_wrapper_drc_routed.pb -rpx design_1_wrapper_drc_routed.rpx
Command: report_drc -file design_1_wrapper_drc_routed.rpt -pb design_1_wrapper_drc_routed.pb -rpx design_1_wrapper_drc_routed.rpx
INFO: [IP_Flow 19-1839] IP Catalog is up to date.
INFO: [DRC 23-27] Running DRC with 2 threads
INFO: [Vivado_Tcl 2-168] The results of DRC are in file C:/Users/dlnmt/man_bram/man_bram.runs/impl_1/design_1_wrapper_drc_routed.rpt.
report_drc completed successfully
INFO: [Vivado 12-24828] Executing command : report_methodology -file design_1_wrapper_methodology_drc_routed.rpt -pb design_1_wrapper_methodology_drc_routed.pb -rpx design_1_wrapper_methodology_drc_routed.rpx
Command: report_methodology -file design_1_wrapper_methodology_drc_routed.rpt -pb design_1_wrapper_methodology_drc_routed.pb -rpx design_1_wrapper_methodology_drc_routed.rpx
INFO: [Timing 38-35] Done setting XDC timing constraints.
INFO: [DRC 23-133] Running Methodology with 2 threads
INFO: [Vivado_Tcl 2-1520] The results of Report Methodology are in file C:/Users/dlnmt/man_bram/man_bram.runs/impl_1/design_1_wrapper_methodology_drc_routed.rpt.
report_methodology completed successfully
INFO: [Vivado 12-24828] Executing command : report_timing_summary -max_paths 10 -routable_nets -report_unconstrained -file design_1_wrapper_timing_summary_routed.rpt -pb design_1_wrapper_timing_summary_routed.pb -rpx design_1_wrapper_timing_summary_routed.rpx -warn_on_violation 
INFO: [Timing 38-35] Done setting XDC timing constraints.
INFO: [Timing 38-91] UpdateTimingParams: Speed grade: -1, Delay Type: min_max.
INFO: [Timing 38-191] Multithreading enabled for timing update using a maximum of 2 CPUs
INFO: [Vivado 12-24838] Running report commands "report_incremental_reuse, report_route_status" in parallel.
Running report generation with 2 threads.
INFO: [Vivado 12-24828] Executing command : report_incremental_reuse -file design_1_wrapper_incremental_reuse_routed.rpt
INFO: [Vivado_Tcl 4-1062] Incremental flow is disabled. No incremental reuse Info to report.
INFO: [Vivado 12-24828] Executing command : report_route_status -file design_1_wrapper_route_status.rpt -pb design_1_wrapper_route_status.pb
INFO: [Vivado 12-24828] Executing command : report_power -file design_1_wrapper_power_routed.rpt -pb design_1_wrapper_power_summary_routed.pb -rpx design_1_wrapper_power_routed.rpx
Command: report_power -file design_1_wrapper_power_routed.rpt -pb design_1_wrapper_power_summary_routed.pb -rpx design_1_wrapper_power_routed.rpx
Running Vector-less Activity Propagation...

Finished Running Vector-less Activity Propagation
136 Infos, 4 Warnings, 10 Critical Warnings and 0 Errors encountered.
report_power completed successfully
INFO: [Vivado 12-24828] Executing command : report_clock_utilization -file design_1_wrapper_clock_utilization_routed.rpt
INFO: [Vivado 12-24828] Executing command : report_bus_skew -warn_on_violation -file design_1_wrapper_bus_skew_routed.rpt -pb design_1_wrapper_bus_skew_routed.pb -rpx design_1_wrapper_bus_skew_routed.rpx
INFO: [Timing 38-91] UpdateTimingParams: Speed grade: -1, Delay Type: min_max.
INFO: [Timing 38-191] Multithreading enabled for timing update using a maximum of 2 CPUs
generate_parallel_reports: Time (s): cpu = 00:00:17 ; elapsed = 00:00:09 . Memory (MB): peak = 2004.234 ; gain = 29.949
INFO: [Timing 38-480] Writing timing data to binary archive.
Write ShapeDB Complete: Time (s): cpu = 00:00:00 ; elapsed = 00:00:00.016 . Memory (MB): peak = 2004.234 ; gain = 0.000
Wrote PlaceDB: Time (s): cpu = 00:00:00 ; elapsed = 00:00:00.330 . Memory (MB): peak = 2007.422 ; gain = 3.188
Wrote PulsedLatchDB: Time (s): cpu = 00:00:00 ; elapsed = 00:00:00 . Memory (MB): peak = 2007.422 ; gain = 0.000
Writing XDEF routing.
Writing XDEF routing logical nets.
Writing XDEF routing special nets.
Wrote RouteStorage: Time (s): cpu = 00:00:00 ; elapsed = 00:00:00.054 . Memory (MB): peak = 2007.422 ; gain = 0.000
Wrote Netlist Cache: Time (s): cpu = 00:00:01 ; elapsed = 00:00:00.005 . Memory (MB): peak = 2007.422 ; gain = 0.000
Wrote Device Cache: Time (s): cpu = 00:00:00 ; elapsed = 00:00:00.007 . Memory (MB): peak = 2007.422 ; gain = 0.000
Write Physdb Complete: Time (s): cpu = 00:00:01 ; elapsed = 00:00:00.402 . Memory (MB): peak = 2007.422 ; gain = 3.188
INFO: [Common 17-1381] The checkpoint 'C:/Users/dlnmt/man_bram/man_bram.runs/impl_1/design_1_wrapper_routed.dcp' has been generated.
INFO: [Common 17-206] Exiting Vivado at Thu Feb 12 23:51:39 2026...

*** Running vivado
    with args -log design_1_wrapper.vdi -applog -m64 -product Vivado -messageDb vivado.pb -mode batch -source design_1_wrapper.tcl -notrace



****** Vivado v2025.1 (64-bit)
  **** SW Build 6140274 on Thu May 22 00:12:29 MDT 2025
  **** IP Build 6138677 on Thu May 22 03:10:11 MDT 2025
  **** SharedData Build 6139179 on Tue May 20 17:58:58 MDT 2025
  **** Start of session at: Thu Feb 12 23:51:58 2026
    ** Copyright 1986-2022 Xilinx, Inc. All Rights Reserved.
    ** Copyright 2022-2025 Advanced Micro Devices, Inc. All Rights Reserved.

source design_1_wrapper.tcl -notrace
Command: open_checkpoint design_1_wrapper_routed.dcp
INFO: [Device 21-403] Loading part xc7s25csga324-1
Netlist sorting complete. Time (s): cpu = 00:00:00 ; elapsed = 00:00:00.041 . Memory (MB): peak = 673.477 ; gain = 0.000
INFO: [Netlist 29-17] Analyzing 136 Unisim elements for replacement
INFO: [Netlist 29-28] Unisim Transformation completed in 1 CPU seconds
INFO: [Project 1-479] Netlist was created with Vivado 2025.1
INFO: [Project 1-570] Preparing netlist for logic optimization
Read ShapeDB Complete: Time (s): cpu = 00:00:00 ; elapsed = 00:00:00.010 . Memory (MB): peak = 788.129 ; gain = 0.000
INFO: [Timing 38-478] Restoring timing data from binary archive.
INFO: [Timing 38-479] Binary timing data restore complete.
INFO: [Project 1-856] Restoring constraints from binary archive.
INFO: [Project 1-853] Binary constraint restore complete.
INFO: [Designutils 20-5722] Start Reading Physical Databases.
Reading placement.
Read Netlist Cache: Time (s): cpu = 00:00:00 ; elapsed = 00:00:00.003 . Memory (MB): peak = 1294.152 ; gain = 0.000
Reading placer database...
Read Device Cache: Time (s): cpu = 00:00:00 ; elapsed = 00:00:00.007 . Memory (MB): peak = 1294.152 ; gain = 0.000
Read PlaceDB: Time (s): cpu = 00:00:00 ; elapsed = 00:00:00.137 . Memory (MB): peak = 1294.152 ; gain = 0.000
Read PulsedLatchDB: Time (s): cpu = 00:00:00 ; elapsed = 00:00:00 . Memory (MB): peak = 1294.152 ; gain = 0.000
Reading routing.
Read RouteStorage: Time (s): cpu = 00:00:00 ; elapsed = 00:00:00.042 . Memory (MB): peak = 1294.152 ; gain = 0.000
Read Physdb Files: Time (s): cpu = 00:00:00 ; elapsed = 00:00:00.197 . Memory (MB): peak = 1294.152 ; gain = 0.000
Restored from archive | CPU: 0.000000 secs | Memory: 0.000000 MB |
Finished XDEF File Restore: Time (s): cpu = 00:00:00 ; elapsed = 00:00:00.242 . Memory (MB): peak = 1294.152 ; gain = 4.566
Netlist sorting complete. Time (s): cpu = 00:00:00 ; elapsed = 00:00:00.002 . Memory (MB): peak = 1294.152 ; gain = 0.000
INFO: [Project 1-111] Unisim Transformation Summary:
  A total of 42 instances were transformed.
  CFGLUT5 => CFGLUT5 (SRL16E, SRLC32E): 36 instances
  RAM32M => RAM32M (RAMD32(x6), RAMS32(x2)): 6 instances

INFO: [Project 1-604] Checkpoint was created with Vivado v2025.1 (64-bit) build 6140274
WARNING: [Vivado 12-23575] Critical violations of the methodology design rules detected. Critical violations may contribute to timing failures or cause functional issues in hardware. Run report_methodology for more information.
open_checkpoint: Time (s): cpu = 00:00:17 ; elapsed = 00:00:16 . Memory (MB): peak = 1294.152 ; gain = 1015.086
Command: write_bitstream -force design_1_wrapper.bit
Attempting to get a license for feature 'Implementation' and/or device 'xc7s25'
INFO: [Common 17-349] Got license for feature 'Implementation' and/or device 'xc7s25'
Running DRC as a precondition to command write_bitstream
INFO: [IP_Flow 19-234] Refreshing IP repositories
INFO: [IP_Flow 19-1704] No user IP repositories specified
INFO: [IP_Flow 19-2313] Loaded Vivado IP repository 'C:/Xilinx/2025.1/Vivado/data/ip'.
INFO: [DRC 23-27] Running DRC with 2 threads
INFO: [Vivado 12-3199] DRC finished with 0 Errors
INFO: [Vivado 12-3200] Please refer to the DRC report (report_drc) for more information.
INFO: [Designutils 20-2272] Running write_bitstream with 2 threads.
Loading data files...
Loading site data...
Loading route data...
Processing options...
Creating bitmap...
Creating bitstream...
Writing bitstream ./design_1_wrapper.bit...
INFO: [Vivado 12-1842] Bitgen Completed Successfully.
INFO: [Project 1-1876] WebTalk data collection is mandatory when using a ULT device. To see the specific WebTalk data collected for your design, open the usage_statistics_webtalk.html or usage_statistics_webtalk.xml file in the implementation directory.
INFO: [Common 17-83] Releasing license: Implementation
23 Infos, 1 Warnings, 0 Critical Warnings and 0 Errors encountered.
write_bitstream completed successfully
write_bitstream: Time (s): cpu = 00:00:16 ; elapsed = 00:00:12 . Memory (MB): peak = 1841.871 ; gain = 547.719
INFO: [Common 17-206] Exiting Vivado at Thu Feb 12 23:52:28 2026...
